{
  "schemaVersion": 1,
  "profiles": {
    "safe": {
      "durationSeconds": 600,
      "requests": 1000,
      "concurrency": 4,
      "generatedDataMegabytes": 0,
      "cpu": 2,
      "memoryMegabytes": 1024,
      "evidenceMegabytes": 25,
      "expectedDuration": "up to 10 minutes"
    },
    "active": {
      "durationSeconds": 1800,
      "requests": 10000,
      "concurrency": 10,
      "generatedDataMegabytes": 100,
      "cpu": 4,
      "memoryMegabytes": 4096,
      "evidenceMegabytes": 100,
      "expectedDuration": "up to 30 minutes"
    },
    "destructive": {
      "durationSeconds": 900,
      "requests": 50000,
      "concurrency": 50,
      "generatedDataMegabytes": 500,
      "cpu": 6,
      "memoryMegabytes": 6144,
      "evidenceMegabytes": 200,
      "expectedDuration": "up to 15 minutes"
    }
  },
  "tools": [
    {
      "id": "target-identity",
      "version": "1.0.0",
      "testIds": []
    },
    {
      "id": "passive-deployment",
      "version": "1.4.0",
      "testIds": ["CSA-DEPLOY-001"]
    },
    {
      "id": "authenticated-zap",
      "version": "2.17.0",
      "testIds": ["CSA-DAST-001"]
    },
    {
      "id": "openapi-fuzzer",
      "version": "v4.32.2",
      "testIds": ["CSA-API-001", "CSA-IMPORT-001"]
    },
    {
      "id": "authorization-matrix",
      "version": "1.0.0",
      "testIds": ["CSA-AUTHN-001", "CSA-AUTHZ-001"]
    },
    {
      "id": "resource-abuse",
      "version": "2.0.0",
      "testIds": ["CSA-RES-001"]
    }
  ],
  "selectedTests": ["CSA-DEPLOY-001", "CSA-AUTHN-001", "CSA-AUTHZ-001", "CSA-DAST-001", "CSA-API-001", "CSA-IMPORT-001", "CSA-RES-001"]
}
